ID,Text,Length
"#631","It takes more than a calorie of fossil fuel energy to produce a calorie of food. From the standpoint of industrial efficiency, it's too bad we can't simply drink the petroleum directly.","185"
"#114","""This man right here,"" McGuiness said, pointing at Kenna, ""he's going to change the world.""  That was his instinctive feeling, and the manager of a band like U2 is a man who knows music. But the people whose world Kenna was supposed to be changing, it seemed, couldn't disagree more, and when the results of all of the consumer research came in, Kenna's once promising career suddenly stalled.","413"
"#437","Every craft and every investigation, and likewise every action and decision, seems to aim at some good; hence the good has been well described as that at which everything aims. However, there is an apparent difference among the ends aimed at. For the end is sometimes an activity, sometimes a product beyond the activity; and when there is an end beyond the action, the product is by nature better than the activity.","416"
"#462","Aztec rule was based upon a system of tribute and fear over the surrounding peoples; every year, they were forced to pay the Aztecs money, goods, and a supply of captives to be sacrificed on the altar. Taking advantage of this resentment of their Aztec overlords, the tiny Spanish force was able to attract a massive army of some 30,000 Mesoamericans of many different tribes.","376"
"#294","Humans need to practice what they are learning a good deal before they master it. Furthermore, they tend to lose a good deal of their learning when they cease to practice the skills associated with this learning in their daily lives.","233"
"#402","Is it sweeter to exist only in the mind or to exist both in the mind and in reality? Flipping out and wailing on guitars is much sweeter when someone is actually doing it. So when we conceive of the sweetest being ever, we are conceiving of the being that exists both in the mind and in reality.","295"
"#26","What should have been swift revenge
turned into an all out war. The City of God was divided. You couldn't
go from one section to the other, not even to visit a relative. The
cops considered anyone living in the slum a hoodlum. People got used
to living in Vietnam, and more and more volunteers signed up to
die.","311"
"#497","He implies there is a correlation between his daily work and the drawings, which leads people to believe he is some type of an architect, but you suspect there is no place for him with even the most incompetent firm.","216"
"#83","I'm telling it like it is. Get used to it or put this book down. Because this book is for America's Heroes. And who are the Heroes? The people who bought this book. People who borrow this book are not Heroes. They are no better than welfare queens mooching off the system like card-carrying library card-carriers. For the record, we're not offering this book to libraries. No free rides.","387"
"#317","The beginner writes just twenty pieces. The professional writes three times what's needed, as many as sixty different bits, keeps trying them out on small groups (but never your own family), rewrites discards, rewrites some more, then finally settles on the twenty which work best for that specific audience.","308"
"#380","They say that right after God created man, he took a rib from him and made a chick. That's actually a bit of a creation myth - the truth is, after God saw that man was good, he created another man and saw that it was all good.","226"
"#347","Is this the real life? Is this just fantasy? Caught in a landslide, no escape from reality. Open your eyes, look up to the skies and see.","137"
"#700","Focus your attention on the Now and tell me what problem you have at this moment. I am not getting any answer because it is impossible to have a problem when your attention is fully in the Now. A situation that needs to be either dealt with or accepted - yes.","259"
"#337","Blessed is he, who in the name of charity and good will, shepherds the weak through the valley of darkness, for he is truly his brother's keeper and the finder of lost children.","177"
"#308","Involuntarily I glanced seaward - and distinguished nothing except a single green light, minute and far away, that might have been the end of a dock. When I looked once more for Gatsby he had vanished, and I was alone again in the unquiet darkness.","248"
"#41","One thing I've learned in the last seven years: in every game and con there's always an opponent, and there's always a victim. The trick is to know when you're the latter, so you can become the former.","202"
"#671","Look and think as far ahead as possible. Often, a driver's natural reaction is to look at the point you're just about to get to. That's not enough.","147"
"#252","A computer needs a manager to administer its operations, just as a company needs a manager.  And that is what DOS is. A manager. It manages the operations in your computer.","172"
"#89","Everyone said I was daft to build a castle on a swamp, but I built it all the same, just to show them. It sank into the swamp. So I built a second one. That sank into the swamp. So I built a third. That burned down, fell over, then sank into the swamp. But the fourth one stayed up. And that's what you're going to get, Lad, the strongest castle in all of England.","364"
"#94","Well, it just so happens, this hacienda comes with its very own private beach. And this private beach just so happens to look particularly beautiful bathed in moonlight. And there just so happens to be a full moon out tonight.","226"
"#280","These contests provided ample opportunity to demonstrate the superiority of alternative keyboard arrangements. That Qwerty survived significant challenges early in the history of typewriting demonstrates that it is at least among the reasonably fit, even if not the fittest that can be imagined.","295"
"#286","We've arranged a global civilization in which most crucial elements profoundly depend on science and technology. We have also arranged things so that almost no one understands science and technology. This is a prescription for disaster.","237"
"#501","O clear intelligence, force beyond all measure! Gentlemen, I beg you to observe these girls: one has just now lost her mind; the other, it seems, has never had a mind at all.","174"
"#98","Is it really necessary to send that
email? The more emails you send, the more work others will have to do
to prioritize your requests. How many of the things you're mentioning
are important? If you have 10 issues to discuss, break them into two
groups and focus on the most important group.","290"
"#516","I can already hear your tune calling me across the room. When the world and his wife are on my back again, not enough pleasure too much pain. When the world is too much with me, please leave, just go away. Before I lose my mind completely, please leave, just go now.","266"
"#640","This business is filled to the brim with unrealistic people who thought their bods aged like wine. If you mean it turns to vinegar, it does. If you mean it gets better with age, it don't. Boxers don't have an old timer's pension.","229"
"#34","What about Tony? You know, Bullet Tooth Tony. He'll find you Moses in the burning bush, if you pay him to. He got shot six times, had the bullets molded into gold. He's the best chance you got of finding Franky.","211"
"#142","It is greatly to America's advantage that it is a congenial atmosphere for the right sort of unruliness - that it is a home not just for the smart, but for the smart-alecks. And hackers are invariably smart-alecks. If we had a national holiday, it would be April 1st.","267"
"#93","An essential characteristic of the superhero mythology is, there's the superhero, and there's the alter ego. Batman is actually Bruce Wayne, Spider-Man is actually Peter Parker. When he wakes up in the morning, he's Peter Parker. He has to put on a costume to become Spider-Man. And it is in that characteristic that Superman stands alone. Superman did not become Superman, Superman was born Superman.","401"
"#328","The alternative to binge travel - the mini retirement - entails relocating to one place for one to six months before going home or moving to another locale. Rather than seeking to see the world, we aim to experience it at a speed that lets it change us.","253"
"#128","The Orient was almost a European invention, and had been since antiquity a place of romance, exotic beings, haunting memories and landscapes, remarkable experiences. Now it was disappearing; in a sense it had happened, its time was over.","237"
"#576","To drive out of the Central Valley of California on a hot day and into San Francisco is to feel like you're landing on another planet. Over our two-hour drive, the temperature went from nearly a hundred to the middle sixties. The visual disparity was as dramatic. On one side of the bay was a day so bright you'd have to squint with the visor down and your sunglasses on. Halfway across the Bay Bridge the fog enveloped us, whipping in strands through the rusted girders. As we crossed into the fog, it didn't seem possible that two such environments could exist side by side.","576"
"#551","We live in a charmed world. If we have money we can buy literally everything. And the majority of us live lifestyles undreamed of only a generation or two ago. One scientist I met recently told me he reckoned that the average household in Europe or North America has so many devices and such a variety of food and clothing that to produce the same lifestyle in Roman times would have required six thousand slaves.","413"
"#359","You've got a way to keep me on your side. You give me cause for love that I can't hide. For you I know I'd even try to turn the tide. Because you're mine, I walk the line.","171"
"#575","One day you're in a funk about things, telling a friend that years of evidence point to the conclusion that you will be single for the rest of your life. That night you meet someone, and a year later you're engaged to be married.","229"
"#131","Common knowledge has bicyclists always riding into the wind, regardless of direction, a perception that is not as wrong as it may seem. On level ground, one rides as fast as is comfortable and because the bicycle is highly efficient, speed is limited by wind resistance. With a tailwind, speeding up until the wind is in one's face is fairly easy, and at that point it becomes a headwind.","388"
"#388","A zealot might be, for instance, an individual with a personal motive for revenge so overpowering that it ensures complete dedication to the cause. Or, through intensive training and psychological manipulation, an elite team of fanatic followers can be trained to sacrifice even their own lives to accomplish a given mission.","325"
"#107","And I said, I don't care if they lay me off either, because I told Bill that if they move my desk one more time, then I'm quitting, I'm going to quit.","150"
"#407","The intelligent person is able to identify a problem and find its optimum solution. Hence, intelligence is effectiveness.","121"
"#147","The National Rifle Association says that, ""Guns don't kill people, uh, people do."" But I think, I think the gun helps. You know? I think it helps. I just think just standing there going, ""Bang!"" That's not going to kill too many people, is it? You'd have to be really dodgy on the heart to have that.","320"
"#48","There was me, that is Alex, and my
three droogs, that is Pete, Georgie, and Dim, Dim being really dim,
and we sat in the Korova Milkbar making up our rassoodocks what to do
with the evening.","190"
"#446","It's a blue savanna song: somewhere cross the desert, sometime in the early hours, in a restless world, on the open highways. My home is where the heart is, sweet to surrender, to you only - I send my love to you.","213"
"#490","Finally, gentlemen, there are people with an hereditary animus against private property. I tell you that you cannot entice a true thief, and thief by vocation, into the prose of honest vegetation by any gingerbread reward, or by the offer of a secure position, or by the gift of money, or by a woman's love: because there is here a permanent beauty of risk, a fascinating abyss of danger, the delightful sinking of the heart, the impetuous pulsation of life, the ecstasy!","471"
"#465","In 1969 four computers located around the country were in communication with each other through ARPANET. By the mid-1980s, the core of the network was in place, the communications protocols had been determined, and the Internet was live. By the early 1990s the first Internet language (http) was written and the first browser was published. The World Wide Web was born.","369"
"#592","Had dreams. Two of 'em. Both had my father. It's peculiar. I'm older now'n he ever was by twenty years. So in a sense he's the younger man. Anyway, first one I don't remember so well but it was about money and I think I lost it. The second one, it was like we was both back in older times and I was on horseback goin' through the mountains of a night.","351"
"#414","Everything we hold dear likewise resolves into its original essence: values, principles, goals, and aspirations. If we take them seriously, we will suffer when they are stolen from us, just as the Lord Buddha taught. But if we see that they are all farts in the wind, and let them fly, then we can dwell in the original essence, which is fragrant and sweet, instead of the fart, which is not.","392"
"#325","Facts can be thought of as objective or subjective. Things and events are objective facts. A subjective fact is one that is limited to the subject experiencing it.","163"
"#607","Grits and fried chicken won't disappear, but perhaps future southerners will enjoy them with a side of rice noodles or enchilada sauce.","135"
"#117","Has it been five years? Six? It
seems like a lifetime, the kind of peak that never comes again. San
Francisco in the middle sixties was a very special time and place to
be a part of. But no explanation, no mix of words or music or memories
can touch that sense of knowing that you were there and alive in that
corner of time and the world. Whatever it meant.","358"
"#216","Now you come to me and you say, ""Don Corleone, give me justice."" But you don't ask with respect. You don't offer friendship. You don't even think to call me Godfather.","178"
"#674","Every time you practice a technique incorrectly, you're increasing your chances of doing it wrong again. Practice doesn't make perfect; only perfect practice makes perfect.","172"
"#423","There is no physical separation after the slicing, so that edge can be ignored and we can treat the pizza, for thermal purposes, as an infinite plane.","150"
"#249","Question marks and exclamation points go inside quotation marks when they apply to the quoted material only. They go outside when they apply to the entire sentence.","164"
"#116","San Francisco in the middle sixties was a very special time and place to be a part of. But no explanation, no mix of words or music or memories can touch that sense of knowing that you were there and alive in that corner of time and the world.","243"
"#667","Some drivers actually perform best when there is a little extra incentive - like chasing another car. But be careful you don't get too caught up in what the competition is doing. Focus on your own performance rather than on the competition.","240"
"#81","I had a dream. There was our world, and the world was dark because there weren't any robins, and the robins represented love. And for the longest time, there was this darkness. Then all of a sudden, thousands of robins were set free and they flew down and brought this blinding light of love. I guess it means that there is trouble until the robins come.","354"
"#102","The place to improve the world is first in one's own heart and head and hands, and then to work outward from there. Other people can talk about how to expand the destiny of mankind. I just want to talk about how to fix a motorcycle. I think that what I have to say has more lasting value.","288"
"#168","Anyway, like I was saying, shrimp is the fruit of the sea. You can barbecue it, boil it, broil it, bake it, saute it. There's shrimp-kabobs, shrimp creole, shrimp gumbo. Pan fried, deep fried, stir-fried.","204"
"#653","I've flown seven million miles. And I've been waiting on people almost 20 years. The best job I could get after my bust was Cabo Air, which is the worst job you can get in this industry. And now with this arrest hanging over my head, I'm scared. If I lose my job I gotta start all over again, but I got nothing to start over with.","330"
"#527","You can't get away with saying ""I don't like green food!"" much beyond your sixth birthday, but you can express a general preference for white, red, or pink wine for all your adult life.","195"
"#250","Ergonomics is a term that combines the Greek word ergon, meaning ""work,"" and the English word economics.  Simply stated, it is ""the study and management of the relationship between the worker and the environment.""","233"
"#330","Let's face it: there are tons of things in your home and life that you don't use, need, or even particularly want. Whether you realize it or not, this clutter creates indecision and distractions, consuming attention and making unfettered happiness a real chore.","262"
"#565","All the blue light reflections that color my mind when I sleep. And the lovesick rejections that accompany the company I keep. All the razor perceptions that cut just a little too deep. Hey I can bleed as well as anyone, but I need someone to help me sleep.","257"
"#406","Webster defines intelligence as, ""the ability to apprehend interrelationships of the perceived facts (and situations) in order to appropriately guide actions toward desired goals."" In other words, the intelligent person is able to identify a problem and find its optimum solution. Hence, intelligence is effectiveness.","328"
"#264","Your ring finger is the most difficult of all fingers to control. You will notice that when you move your ring finger your other fingers will move involuntarily as well.  This is something that will become less of a problem as you perfect your keyboarding skills.","263"
"#300","I am learning about twenty new Italian words a day. Where am I getting the brain space to store these words?  I'm hoping that maybe my mind has decided to clear out some old negative thoughts and sad memories and replace them with these shiny new words.","253"
"#448","We were playing checkers. I used to kid her once in a while because she wouldn't take her kings out of the back row. But I didn't kid her much though. You never wanted to kid Jane too much. I think I really like it best when you can kid the pants off a girl when the opportunity arises, but it's a funny thing. The girls I like best are ones I never feel much like kidding. Sometimes I think they'd like it if you kidded them - in fact I know they would - but it's hard to get started, once you've known them a pretty long time and never kidded them.","550"
"#694","How do I live without the ones I love? Time still turns the pages of the book it's burned. Place and time always on my mind. I have so much to say but you're so far away.","170"
"#55","I know that you weren't bored that day because there was a lot of stuff on TV, and then The Blair Witch Project was coming on Starz and you were like, ""I haven't seen this since it came out and if so we should watch it"" and then, ""but oh, no, we should just make out instead!""","276"
"#341","If I leave here tomorrow, would you still remember me? For I must be traveling on now, 'cause there's too many places I've got to see.","134"
"#146","In 1966, Andy Dufresne escaped from Shawshank prison. All they found of him was a muddy set of prison clothes, a bar of soap, and an old rock hammer, damn near worn down to the nub. I used to think it would take six-hundred years to tunnel under the wall with it. Old Andy did it in less than twenty.","300"
"#536","When you are immune to the opinions and actions of others, you won't be the victim of needless suffering.","105"
"#589","Mac knew the score even if Aunt Ella didn't. Shot through the left lung and that was that, as they say. Believe it was that night. She buried him the next mornin. Diggin in that hard caliche. What you got ain't nothin new. This country is hard on people. Hard and crazy. Got the devil in it yet folks never seem to hold it to account.","334"
"#505","That fear had been inside him for many years, it had lived with him, it had been another shadow ever since the night he awoke, shaken by a bad dream, and realized that death was not only a permanent probability, as he has always believed, but an immediate reality.","264"
"#205","A glooming peace this morning with it brings. The sun for sorrow will not show its head. Go hence to have more talk of these sad things. Some shall be pardoned and some punished. For never was a story of more woe than this of Juliet and her Romeo.","247"
"#57","The Peacocks are not dancing so it will not rain. The Peacocks are not dancing so it will not rain? Have you been smoking Ganja?","128"
"#70","We don't need no education. We don't need no thought control. No dark sarcasm in the classroom - teachers leave them kids alone! All in all it's just another brick in the wall.","176"
"#339","I know what ""exacerbate"" means.  There is not a word or a sentence or a concept that you can illuminate for me.","121"
"#18","If I'm curt with you it's because time is a factor. I think fast, I talk fast and I need you guys to act fast if you wanna get out of this. So, pretty please with sugar on top. Clean the car!","191"
"#410","The idea of ""Mr. Right"" has been passed down over the generations that for every woman there is the perfect man for her. I laugh at the whole notion and you should too. Here's why: The concept of a perfect match, one that requires no efforts on your part, creates unreasonable expectations that force a disparity between ""ideal"" and ""reality"" that always leads to disappointment.","409"
"#479","Wood and other fibrous material is mixed with liquid and mashed into a pulp, which is then poured onto fine screens. The liquid drains away, leaving a thin layer of fibrous material on the wire. When this material dries, it becomes paper.","238"
"#152","Warmer water increases the moisture content of storms, and warmer air holds more moisture. When storm conditions trigger a downpour, more of it falls in the form of big, one-time rainfalls and snowfalls.","203"
"#499","Ideology: the process of making ideas. Certain artisans were chosen for this occupation at an early age and were trained in mental workhouses or asylums. They were known as idealists, and were expected to provide a fixed number of ideas to be exhibited or dramatised for the benefit of the public.","297"
"#228","He canceled all his commitments and
pulled together the most important of his books, and now here he was
sitting inside a dusty, smelly warehouse. Outside, a huge caravan was
being prepared for a crossing of the Sahara, and was scheduled to pass
through Al-Fayoum.","264"
"#680","Races are not won in the first corner; however, they are often lost there. It's usually best to run as quick as you can for the first few laps, then settle into a comfortable, consistent pace.","192"
"#145","The only people for me are the mad ones, the ones who are mad to live, mad to talk, mad to be saved, desirous of everything at the same time, the ones who never yawn or say a commonplace thing, but burn, burn, burn, like fabulous yellow Roman candles exploding like spiders across the stars, and in the middle, you see the blue center-light pop, and everybody goes ahh...","371"
"#361","I had a job, I had a girl. I had something going, mister, in this world. I got laid off down at the lumber yard, our love went bad, times got hard. Now I work down at the carwash, where all it ever does is rain. Don't you feel like you're a rider on a downbound train.","268"
"#600","I don't believe in an interventionist God, but I know, darling, that you do. But if I did I would kneel down and ask him not to intervene when it came to you.","158"
"#124","You have to wonder: how do the
machines know what Tasty Wheat tasted like? Maybe they got it wrong.
Maybe what I think Tasty Wheat tasted like actually tasted like
oatmeal, or tuna fish. That makes you wonder about a lot of things.
You take chicken, for example: maybe they couldn't figure out what to
make chicken taste like, which is why chicken tastes like
everything.","371"
"#624","At the very end of these food chains (which is to say, at the very beginning), I invariably found myself in almost exactly the same place: a farm field in the American Corn Belt.","178"
"#601","And I don't believe in the
existence of angels but looking at you I wonder if that's true. But if
I did I would summon them together, and ask them to watch over you. To
each burn a candle for you, to make bright and clear your path. And to
walk, like Christ, in grace and love and guide you into my
arms.","304"
"#194","Chance and chance alone has a message for us. Everything that occurs out of necessity, everything expected, repeated day in and day out, is mute. Only chance can speak to us. We read its message much as gypsies read the images made by coffee grounds at the bottom of a cup.","273"
"#451","Stab a sorry heart with your favorite finger. Paint the whole world blue and stop your tears from stinging. Hear the cavemen singing. Good news they're bringing. Seven seas, swimming them so well. Glad to see my face among them kissing the tortoise shell.","255"
