ID,Text,Length
"#491","You cannot entice a true thief, and thief by vocation, into the prose of honest vegetation by any gingerbread reward, or by the offer of a secure position, or by the gift of money, or by a woman's love: because there is here a permanent beauty of risk, a fascinating abyss of danger, the delightful sinking of the heart, the impetuous pulsation of life, the ecstasy!","366"
"#657","If you want to drive a race car well, whether to win an Indy car race or just have fun competing in the middle of the pack in an amateur race, you must be seated properly in the car. First of all, you must be comfortable, otherwise it will be overly tiring and very difficult to concentrate. Many races have been lost simply because a driver lost concentration due to discomfort from a poorly fitted seat.","405"
"#9","But the two men were not lonely at all. At home they were content to eat and drink, and Singer would talk with his hands eagerly to his friend about all that was in his mind. So the years passed in this quiet way until Singer reached the age of thirty-two.","256"
"#670","Look and think as far ahead as possible. Often, a driver's natural reaction is to look at the wall or the point you're just about to get to. That's not enough. You won't drive a smooth, flowing line if you don't look far ahead.","227"
"#92","Make sure to secure the door when I am gone. There are many dangerous people who wanna take things from Americans, and also kidnap them. Good night!","148"
"#233","In 1972, domestic oil production peaked and then began its inexorable, irreversible decline. The year before, the prerogative of setting the price of crude oil had passed into the hands of a new producer group, the Organization of the Petroleum Exporting Countries.","265"
"#7","The day dawned bleak and chill, a moving wall of gray light out of the northeast which, instead of dissolving into moisture, seemed to disintegrate into minute and venomous  particles, like dust that, when Dilsey opened the door of the cabin and emerged, needled laterally into her flesh, precipitating not so much a moisture as a substance partaking of the quality of thin, not quite congealed oil.","399"
"#273","Other keyboard layouts have been created since, and some are demonstrably more efficient, but the original continues to thrive. It is a telling demonstration of the power of inertia and the reward of being first.","212"
"#215","You found paradise in America. You
had a good trade, made a good living, the police protected you and
there were courts of law and you didn't need a friend like me. But,
now you come to me and you say, ""Don Corleone, give me
justice."" But you don't ask with respect. You don't offer
friendship. You don't even think to call me Godfather.","347"
"#170","That day, for no particular reason, I decided to go for a little run. So I ran to the end of the road. And when I got there, I thought maybe I'd run to the end of town. And when I got there, I thought maybe I'd just run across Greenbow County. And I figured, since I run this far, maybe I'd just run across the great state of Alabama.","334"
"#190","You have a class of young strong
men and women, and they want to give their lives to something.
Advertising has these people chasing cars and clothes they don't need.
Generations have been working in jobs they hate, just so they can buy
what they don't really need.","265"
"#295","Good games offer players a set of
challenging problems and then let them practice these until they have
routinized their mastery.","129"
"#200","In order to become an elf I filled out ten pages' worth of forms, took a multiple choice personality test, underwent two interviews and a drug test.  The first interview was general, designed to eliminate obvious sociopaths. During the second interview we were asked why we wanted to be elves.","293"
"#311","When we pulled out into the winter night and the real snow, our snow, began to stretch out beside us and twinkle against the windows, and the dim lights of small Wisconsin stations moved by, a sharp wild brace came suddenly into the air.","237"
"#665","The less you do with the controls, the less chance of error. The slower you move, the faster the car moves.","107"
"#269","Sholes consulted with an educator who helped him analyze the most common pairings of letters in the English language. He then split up those letters so that their type bars were farther apart and less likely to jam. That in turn dictated the layout of the keyboard - known as QWERTY, for the first five letters in the upper row. In a manner of speaking, he slowed down the typists to prevent jamming, and thus speed up the typing.","430"
"#49","The boy has not a real choice, has he? Self-interest, the fear of physical pain drove him to that grotesque act of self-abasement. The insincerity was clear to be seen. He ceases to be a wrongdoer. He ceases also to be a creature capable of moral choice.","254"
"#593","Had dreams. Two of 'em. Both had my father. It's peculiar. I'm older now'n he ever was by twenty years. So in a sense he's the younger man.","139"
"#358","People get ready, there's a train coming. You don't need no baggage, you just get on board. All you need is faith to hear the diesels humming. Don't need no ticket, you just thank the Lord.","189"
"#481","The development of a living body of literature became indicative of an advanced culture and are always correlated with advances in science, philosophy, theology, and art. Unfortunately the loss of many libraries, such as the Great Library of Alexandria in a civil war in the 3rd century AD, also heralded the loss of many of these irreplaceable texts.","351"
"#561","Well I woke in mid-afternoon cause that's when it all hurts the most. I dream I never know anyone at the party and I'm always the host. If dreams are like movies, then memories are films about ghosts. You can never escape, you can only move south down the coast.","262"
"#180","I had the impression of being abandoned by everyone when the whole city rose and left for the summer. Whether I went to Nevsky Avenue, to the park, or wandered along the embankments, I never came across the people I was accustomed to meet in certain spots at certain hours all year round. They, of course, didn't know me; but I knew them all right.","348"
"#316","Quality humor doesn't just deliver
one gag and then tax the audience's patience developing a new setup.
Once you've got the audience laughing or on a roll, it's better to
stay with toopers - a series of punch lines, each related to the
previous one.","249"
"#645","Thing is Butch, right now you got ability. But painful as it may be, ability don't last. Now that's a hard fact of life, but it's a fact of life you're gonna have to get realistic about.","186"
"#382","All Ninja are men of peace, and must always remain so or lose many of the special powers they have developed. Beyond this, the Ninja are also adept at fieldcraft, infiltrating, and espionage.","191"
"#511","Your faith was strong but you needed proof. You saw her bathing on the roof. Her beauty in the moonlight overthrew you. She tied you to a kitchen chair, she broke your throne she cut your hair and from your lips she drew the hallelujah.","236"
"#135","I rejected those answers; instead, I chose something different. I chose the impossible. I chose Rapture, a city where the artist would not fear the censor. Where the scientist would not be bound by petty morality. Where the great would not be constrained by the small! And with the sweat of your brow, Rapture can become your city as well.","339"
"#191","Advertising has these people chasing cars and clothes they don't need. Generations have been working in jobs they hate, just so they can buy what they don't really need.","169"
"#85","In May 1980, Fidel Castro opened the
harbor at Mariel, Cuba with the apparent intention of letting some of
his people join their relatives in the United States. Within
seventy-two hours, 3,000 U.S. boats were headed for Cuba. It soon
became evident that Castro was forcing the boat owners to carry back
with them not only their relatives, but the dregs of his
jails.","366"
"#154","The problem we now face is that this thin layer of atmosphere is being thickened by huge quantities of human-caused carbon dioxide and other greenhouse gases. And as it thickens, it traps a lot of the infrared radiation that would otherwise escape the atmosphere and continue out to the universe.","296"
"#126","Let me tell you why you're here. You're here because you know something. What you know you can't explain, but you feel it. You've felt it your entire life, that there's something wrong with the world. You don't know what it is, but it's there, like a splinter in your mind, driving you mad. It is this feeling that has brought you to me. Do you know what I'm talking about?","373"
"#442","But if in efficient causes it is
possible to go on to infinity, there will be no first efficient cause,
neither will there be an ultimate effect, nor any intermediate
efficient causes; all of which is plainly false. Therefore it is
necessary to admit a first efficient cause, to which everyone gives
the name of God.","316"
"#673","Every time you practice a technique incorrectly, you're increasing your chances of doing it wrong again. It's easy to become very experienced at repeating the same mistakes. Practice doesn't make perfect; only perfect practice makes perfect.","241"
"#3","No man is an island, entire of itself; every man is a piece of the continent, a part of the main. If a clod be washed away by the sea, Europe is the less, as well as if a promontory were, as well as if a manor of thy friend's or of thine own were: any man's death diminishes me, because I am involved in mankind, and therefore never send to know for whom the bell tolls; it tolls for thee.","389"
"#64","Step out the front door like a ghost into the fog where no one notices the contrast of white on white. And in between the moon and you the angels get a better view of the crumbling difference between wrong and right. I walk in the air between the rain through myself and back again. Where? I don't know.","303"
"#430","Radiation could be precisely determined, in principle, if we knew the reflectance of mozzarella and the cardboard in the long-wavelength regions of interest. The process is clearly governed by the Stefan-Boltzmann fourth power radiation law. Here, the oregano and other trace materials sitting on the surface might be of some importance if they changed the surface radiance in any appreciable way.","397"
"#307","I know a bloke who knows a bloke
who knows a bloke. Now, I know you know this bloke. This is a bloke
you know.","110"
"#352","With the coming of Dean Moriarty began the part of my life you could call my life on the road. Before that I'd often dreamed of going West to see the country, always vaguely planning and never taking off.","204"
"#38","Do you know why they call him Franky ""Four Fingers"" Doug? Because he makes stupid bets with dangerous people, and when he doesn't pay up, they give him the chop, Doug. And I'm not talking about his foreskin either.","214"
"#587","Come sail your ships around me and burn your bridges down. We make a little history, baby, every time you come around.","118"
"#66","Hello, hello, hello, is there anybody in there? Just nod if you can hear me. Is there anyone home? Come on, come on, out, I hear you're feeling down. I can ease your pain and get you on your feet again. Relax, relax, relax, I need some information first. Just the basic facts, can you show me where it hurts?","308"
"#28","We turn away to face the cold, enduring chill, as the day begs the night for mercy love. The sun so bright it leaves no shadows, only scars, carved into stone on the face of earth. The moon is up and over One Tree Hill we see the sun go down in your eyes.","255"
"#90","Everyone said I was daft to build a castle on a swamp, but I built it all the same, just to show them. It sank into the swamp. So I built a second one. That sank into the swamp. So I built a third. That burned down, fell over, then sank into the swamp. But the fourth one stayed up!","282"
"#649","I must not fear. Fear is the mind killer. Fear is the little death that brings total obliteration. I will face my fear. I will permit it to pass over me and through me. And when my fear is gone I will turn and face fear's path, and only I will remain.","251"
"#6","The creation ends in South Georgia, at the very edge of the sweet earth. Only the sky, widest of the wide, goes on, flatness against flatness. The sky appears so close that, with a long-enough extension ladder, you think you could touch it, and sometimes you do, when clouds descend in the night to set a fine pelt of dew on the grasses, leaving behind white trails of fog and mist.","382"
"#461","For all its apparent strength, the Aztec Empire had vulnerabilities that the Spanish were able to exploit. The tiny Spanish force was able to attract a massive army of some 30,000 Mesoamericans of many different tribes.","219"
"#401","He managed to open the cupboard door with his nose and found the 25-pound bag of low-fart dog biscuits the vet had prescribed for him, which had made him fart more. Even though he knew they made him fart more, he couldn't resist. He ate the entire bag.","252"
"#229","The most precious treasures we have
in life are the images we store in the memory banks of our brains. The
sum of these stored experiences is responsible for our sense of
personal identity and our sense of connectedness to those around
us.","239"
"#431","Radiation could be precisely determined, in principle, if we knew the reflectance of mozzarella and the cardboard in the long-wavelength regions of interest.","157"
"#560","When the green lights came on, pedestrians skirted or jumped across the puddles gathering at the curbs.","103"
"#443","Consider this: Is the pious being loved by the gods because it is pious, or is it pious because it is being loved by the Gods?","126"
"#296","Good games stay within, but at the outer edge, of the player's regime of competence. That is, they feel doable but challenging. This makes them pleasantly frustrating - a flow state for human beings.","199"
"#51","I've seen things you people wouldn't believe. Attack ships on fire off the shoulder of Orion. I watched C-beams glitter in the dark near the Tannhauser gate. All those moments will be lost in time, like tears in rain.","217"
"#72","Ticking away the moments that make up a dull day, you fritter and waste the hours in an off-hand way. Kicking around on a piece of ground in your home town, waiting for someone or something to show you the way.","210"
"#603","Having endured the racial turmoil of the Civil Rights Movement without the overt violent conflict that haunted some of its southern neighbors, Atlanta was a city obsessed with economic progress. Just as editor Henry Grady had looked north for investment and support in the wake of the Civil War, the city's newest generation of boosters saw international dollars as the future for Atlanta.","389"
"#137","Like painting, most software is intended for a human audience. And so hackers, like painters, must have empathy to do really great work. You have to be able to see things from the user's point of view.","201"
"#651","It is by will alone I set my mind in motion. It is by the juice of Sapho that thoughts acquire speed, the lips acquire stains, the stains become a warning. It is by will alone I set my mind in motion.","200"
"#547","I'm so glad you came, I'm so glad you remembered, to see how we're ending our last dance together. Reluctantly, cautiously, but prettier than ever - I really believe that this time it's forever.","194"
"#144","He's got a two day head start on you, which is more than he needs. Brody's got friends in every town and village from here to the Sudan, he speaks a dozen languages, knows every local custom, he'll blend in, disappear, you'll never see him again. With any luck, he's got the grail already.","289"
"#261","Keying text quickly is important, but it is more important to be able to make it look professional. Presenting text is more than just placing one letter after another. Making the text readable involves positioning, style, and size.","231"
"#88","Listen, strange women lyin' in ponds distributin' swords is no basis for a system of government. Supreme executive power derives from a mandate from the masses, not from some farcical aquatic ceremony.","201"
"#224","It's the possibility of having a dream come true that makes life interesting, he thought, as he looked again at the position of the sun, and hurried his pace. He had suddenly remembered that, in Tarifa, there was an old woman who interpreted dreams.","249"
"#426","First, the layer of dough bakes into bread, a low-water-content material with a large number of nonconnecting small air spaces. Second, the tomato paste dehydrates, and third, the mozzarella undergoes a complex series of transitions involving protein denaturation and lipid rearrangement from regular liquid crystal to more disordered states.","342"
"#4","I can feel the heat closing in, feel them out there making their moves, setting up their devil doll stool pigeons, crooning over my spoon and dropper I throw away at Washington Square Station, vault a turnstile and two flights down the iron stairs, catch an uptown A train.","273"
"#132","We sit silently and watch the world around us. This has taken us a lifetime to learn. It seems only the old are able to sit next to one another and not say anything and still feel content. The young, brash and impatient, must always break the silence. It is a waste, for silence is pure.","287"
"#648","I'll miss the sea, but a person needs new experiences. Without change something sleeps inside us, and seldom awakens.","117"
"#268","The typewriter had a problem, though. Try to type quickly on it, and the type bars banged into one another and got stuck. The solution to that problem resulted in the keyboard we know today.","190"
"#550","Remembering you standing quiet in the rain as I ran to your heart to be near. And we kissed as the sky fell in holding you close how I always held close in your fear.","166"
"#419","I know that the idea of raising well-rounded, smarter kids can be daunting. And sadly, no easy formula exists. Kids are as complex, varied, and exciting individuals as you are. The good news is that your child has a natural desire to do well. Your job as parent is to bring out this quality and cherish it until the day your kids leave home, and then some.","356"
"#693","The hectic speed, and the brevity of the lines in the thread, plus the feeling that everyone is talking at once, at counter-purposes, deter her.","144"
"#25","Let's sort the buyers from the spiers, the needy from the greedy, and those who trust me from the ones who don't, because if you can't see value here today, you're not up here shopping. You're up here shoplifting. Anyone like jewelry? Look at that one there. Handmade in Italy, hand-stolen in Stepney. It's as long as my arm. Here - one price - ten pound.","356"
"#509","I've heard there was a secret chord that David played, and it pleased the Lord, but you don't really care for music, do you? It goes like this: the fourth, the fifth, the minor fall, the major lift. The baffled king composing hallelujah.","237"
"#543","She looked terrific. I said to myself, ""Maybe she's going to be in the Spanish class - that'll be great!"" But no, she walked into the Portuguese class. So I figured, what the hell - I might as well learn Portuguese.","225"
"#467","The theory of music emphasizes the elements from which music is composed. One such structure is the melody, which is a grouping of musical notes that combine into a basic, but immensely flexible structure. Another is the chord, which is two or more notes played simultaneously to create a harmony.","297"
"#554","Because most of the 150,000 tons of gold ever mined is still in circulation, the gold on my finger could have been mined in Persia six thousand years ago, or worn by Cleopatra.","176"
"#472","In the late 1960s, a growing number of people became concerned about the growing problems of pollution and the destruction of natural habitats. This movement led to the formation of groups like the Environmental Protection Agency (EPA). The primary goal of the environmental movement as a whole is to make sure that the environment is safe and intact for future generations to enjoy.","383"
"#5","Thirdly, however, these wars could now be waged with the new technology of capitalism. Since this technology, through the camera and the telegraph, also transformed the reporting of war in the press, it now brought its reality more vividly before the literate public.","267"
"#588","Your face has fallen sad now, for you know the time is nigh. But when I must remove your wings and you, you must try to fly. Come sail your ships around me and burn your bridges down. We make a little history, baby, every time you come around.","243"
"#67","There is no pain, you are receding.
A distant ship smoke on the horizon. You are only coming through in
waves. Your lips move but I can't hear what you're saying. When I was
a child, I had a fever. My hands felt just like two balloons. Now I've
got that feeling once again. I can't explain you will not understand.
This is not how I am.","336"
"#84","And today, Lady Liberty is under attack from the cable channels, the internet blogs, and the Hollywood celebritocracy, out there spewing ""facts"" like so many locusts descending on America's crop of ripe, tender values. And as any farmer or biblical scholar will tell you, locusts are damn hard to get rid of.","308"
"#56","I'm a hopeless dancer, but this looks like you just screw in a light bulb with one hand and pat the dog with the other. Watch yourself, Darcy, he's about to transform into the Indian MC Hammer!","193"
"#622","The great edifice of variety and choice that is an American supermarket turns out to rest on a remarkably narrow biological foundation comprised of a tiny group of plants that is dominated by a single species: Zea mays, the giant tropical grass most Americans know as corn.","273"
"#591","Had dreams. Two of 'em. Both had my father. It's peculiar. I'm older now'n he ever was by twenty years. So in a sense he's the younger man. Anyway, first one I don't remember so well but it was about money and I think I lost it. The second one, it was like we was both back in older times and I was on horseback goin' through the mountains of a night. Goin' through this pass in the mountains. It was cold and snowin, hard ridin. Hard country.","443"
"#373","He was rough around the edges. He'd been to school, but never finished. He'd been to jail, but never prison. And it was his first day off in forever, man. The festival seemed like a pretty good plan: cruise some chicks and get a suntan. And his friend gave him four, but said only take one. But then he got bored and he ended up taking all four, so now my man ain't that bored anyways. The paramedics found him, he was shaking on the side of the stage.","452"
"#305","I hope that whoever you are, you escape this place. I hope that the world turns and that things get better. But what I hope most of all is that you understand what I mean when I tell you that even though I do not know you, and even though I may never meet you, laugh with you, cry with you, or kiss you, I love you.","315"
"#349","My friend, I shall be pedagogic, and say you ought to start with Logic. Even eating and drinking, so easy and free, can only be done with One, Two, Three.","154"
"#39","It turned out that the sweet-talking, tattoo-sporting pikey was a gypsy bare-knuckle boxing champion. Which makes him harder than a coffin nail. Right now, that's the last thing on Tommy's mind. If Gorgeous doesn't wake up in the next few minutes, Tommy knows he'll be buried with him.","285"
"#544","I'm so glad you came, I'm so glad you remembered, to see how we're ending our last dance together. Expectant, too punctual, but prettier than ever, I really believe that this time it's forever.","193"
"#335","During the battle, Rebel spies managed to steal secret plans to the Empire's ultimate weapon. Pursued by the Empire's sinister agents, Princess Leia races home aboard her starship, custodian of the stolen plans that can save her people and restore freedom to the galaxy.","270"
"#91","King, eh? Very nice. And how'd you get that, eh? By exploiting the workers. By hanging on to outdated imperialist dogma which perpetuates the economic and social differences in our society.","189"
"#400","When Betty and Billy fell asleep, he walked down to the kitchen to see if there was anything around to eat. He managed to open the cupboard door with his nose and found the 25-pound bag of low-fart dog biscuits the vet had prescribed for him, which had made him fart more. Even though he knew they made him fart more, he couldn't resist. He ate the entire bag.","360"
"#12","What good's a reward if you ain't around to use it? Besides, attacking that battle station ain't my idea of courage. It's more like... suicide.","143"
"#695","I've been thinking lots about my life and how quick I'd wash it down the drain. Past tense, the future, nothing matters now. I act on my own and I'm to blame. Living's a wicked dream, where things turn out all wrong. We're all so weak, no matter how strong.","257"
"#282","I'd just like to point out that you were given every opportunity to succeed. There was even going to be a party for you. A big party that all your friends were invited to. I invited your best friend the companion cube. Of course, he couldn't come because you murdered him. All your other friends couldn't come either because you don't have any other friends.","358"
