ID,Text,Length
"#630","It takes more than a calorie of
fossil fuel energy to produce a calorie of food. From the standpoint
of industrial efficiency, it's too bad we can't simply drink the
petroleum directly, because there's a lot less energy in a bushel of
corn (measured in calories) than there is in the half gallon or so of
oil required to produce it. Ecologically this is a fabulously
expensive way to produce food.","397"
"#314","So what's in this for you? Should you rush out in search of a mission? Should you quit your job and find a goal? Probably not. But look around you. You may be on a mission, and not realize it yet.","196"
"#290","At first they had tried to keep the
finding quiet. After all, they were not absolutely sure it was an
extraterrestrial message. A premature or mistaken announcement would
be a public relations disaster. But worse than that, it would
interfere with the data analysis. If the press descended, the science
would surely suffer.","323"
"#590","This country is hard on people. Hard and crazy. Got the devil in it yet folks never seem to hold it to account.","111"
"#684","How many times have you seen the leader of a race have a mechanical problem with only a few laps to go? You will never be able to take advantage of their problems if you are not close. You have to be close to take advantage of luck.","232"
"#678","Races are not won in the first corner; however, they are often lost there. It's usually best to run as quick as you can for the first few laps, then settle into a comfortable, consistent pace - all the while ready to take advantage of any opportunity to pass. Never turn down an opportunity to pass - you may not get it again.","326"
"#672","We often believe the more we practice a skill or technique - over and over again, many times - the better we'll get. This is not necessarily true. In fact, every time you practice a technique incorrectly, you're increasing your chances of doing it wrong again. It's easy to become very experienced at repeating the same mistakes. Practice doesn't make perfect; only perfect practice makes perfect.","397"
"#287","In the witch trials, it was nearly impossible to provide compelling alibis for accused witches: The rules of evidence had a special character. For example, in more than one case a husband attested that his wife was asleep in his arms at the very moment she was accused of frolicking with the devil; but the archbishop patiently explained that a demon had taken the place of the wife.","383"
"#697","Ultimately, this is not about solving your problems. It's about realizing that there are no problems. Only situations - to be dealt with now, or to be left alone and accepted as part of the ""isness"" of the present moment until they change or can be dealt with.","260"
"#213","We've known each other for many years but this is the first time you've ever come to me for counsel or for help. I can't remember the last time you invited me to your house for a cup of coffee, even though my wife is Godmother to your only child. But, let's be frank here. You never wanted my friendship and you were afraid to be in my debt.","341"
"#418","The sooner your kids appreciate the value of work, the more successful they will be. Work is part of life. You work to earn money, put food on the table, and keep your homes orderly and clean. For your kids, work involves schoolwork, homework, and teamwork at home and in the community.","286"
"#79","My dog barks some. Mentally you picture my dog, but I have not told you the type of dog which I have. Perhaps you even picture Toto, from ""The Wizard of Oz."" But I warn you, my dog is always with me. Woof!","205"
"#496","You ask Raymond what he does for a living and he says, ""I breathe and walk and when I'm told to sit I sit and when I'm told to leave I leave and return home to luxuriate and think how much I despise them."" He implies there is a correlation between his daily work and the drawings, which leads people to believe he is some type of an architect, but you suspect there is no place for him with even the most incompetent firm.","432"
"#127","It was one of those days when it's a minute away from snowing and there's this electricity in the air, you can almost hear it. And this bag was, like, dancing with me. Like a little kid begging me to play with it. For fifteen minutes. And that's the day I knew there was this entire life behind things, and this incredibly benevolent force.","340"
"#569","A total of twenty-five friends were headed from San Francisco across the Sierra toward our rendezvous in the Black Rock Desert that day. Significantly absent among them was Julia, my girlfriend at the time. We were all in our late twenties or early-to-middle thirties, yet none had found brides or husbands. Although we were all older than our parents were when they had us, the idea of having children ourselves still seemed a far-off abstraction.","448"
"#394","Instead of hiring workers during the peak hog kill in the winter and then laying them off when the work slowed down, Jay had instituted a system of paying workers a steady wage year-round. A 1937 Fortune magazine article about this and other progressive labor policies at Hormel might well shock those familiar only with the company's labor relations in the 1980s.","364"
"#32","And you know it's time to go,
through the sleet and driving snow, across the fields of mourning,
light in the distance. And you hunger for the time - time to heal,
desire time, and your earth moves beneath your own dream
landscape.","231"
"#456","Right, I am going to tell you how this works. You're going in the drink and I am going to make a cup of tea. Underneath the floor boards is the famous river Thames. I hope for your sakes you can hold your breath for as long as it takes to boil that kettle. After that, I am going to ask you a question, one question. You are going to give me a name and if it's the right name, I send you home warm and dry in a fresh set of clothes. If it's the wrong name, you'll be fed to the crayfish.","487"
"#175","I drew the blankets over my head and tried to think of Christmas. But the grey face still followed me. It murmured, and I understood that it desired to confess something.","170"
"#22","The problem is, Willie, is that Charles and yourself are not the quickest of cats at the best of times. So just do as I say and keep the cage locked!","149"
"#232","Prior to the 1970's, because the United States had long been the world's number one producer of petroleum, American companies determined the global price of oil. In 1972, domestic oil production peaked and then began its inexorable, irreversible decline. The year before, the prerogative of setting the price of crude oil had passed into the hands of a new producer group, the Organization of the Petroleum Exporting Countries.","427"
"#531","The wine list looks so imposing that you finally give up laboring over it. You hand it back to the server and say (either a bit sheepishly, because you're acknowledging that you can't handle the list, or with defiant bravado, signifying that you're not going to waste your time on this nonsense), ""I'll just have a glass of white wine."" Smart move or big mistake? We'd say, ""Mistake.""","404"
"#63","Whenever you watch the mind, you withdraw consciousness from mind forms, and it then becomes what we call the watcher or the witness.","133"
"#242","Whether you're a student, secretary, office administrator, manager, computer programmer, or engineer; whether you use a PC, laptop, or typewriter -  typing is an invaluable skill. It's a skill that can open doors and enhance your career opportunities. In this high-tech world of computer-generated communications, anyone who can't type runs the risk of being excluded from many business transactions.","400"
"#494","She was a genius of sadness, immersing herself in it, separating its numerous strands, appreciating its subtle nuances. She was a prism through which sadness could be divided into its infinite spectrum. Brod discovered 613 sadnesses, each perfectly unique, each a singular emotion, no more similar to any other sadness than to anger, ecstasy, guilt, or frustration.","365"
"#271","Sholes split up the most common pairings of letters in the English language so that their type bars were farther apart and less likely to jam. That in turn dictated the layout of the keyboard - known as QWERTY, for the first five letters in the upper row.","255"
"#688","The forum has become one of the most consistent places in her life, like a familiar cafe that exists somehow outside of geography and beyond time zones.","152"
"#219","A long time ago, I was in Burma, my friends and I were working for the local government. They were trying to buy the loyalty of tribal leaders by bribing them with precious stones. But their caravans were being raided in a forest north of Rangoon by a bandit. So we went looking for the stones. But in six months, we never found anyone who traded with him. Then, one day I saw a child playing with a ruby the size of a tangerine. The bandit had been throwing them away.","469"
"#239","There is a theory which states that if anybody ever discovers exactly what the Universe is for and why it is here, it will instantly disappear and be replaced by something even more bizarre and inexplicable. There is another theory which states that this has already happened.","276"
"#111","If you are given too many choices, if you are forced to consider much more than your unconscious is comfortable with, you get paralyzed. Snap judgments can be made in a snap because they are frugal, and if we want to protect our snap judgments, we have to take steps to protect that frugality.","293"
"#133","We sit silently and watch the world
around us. This has taken us a lifetime to learn. It seems only the
old are able to sit next to one another and not say anything and still
feel content. The young, brash and impatient, must always break the
silence. It is a waste, for silence is pure. Silence is holy. It draws
people together because only those who are comfortable with each other
can sit without speaking. This is the great paradox.","437"
"#495","She was a genius of sadness, immersing herself in it, separating its numerous strands, appreciating its subtle nuances. She was a prism through which sadness could be divided into its infinite spectrum.","202"
"#193","At the time when Britain faced a plunge into chaos and darkness, a hero emerged who not only succeeded in getting the feuding tribes to work together against their common enemy, but led them in a series of smashing victories that established him as a figure of great power and importance - a figure ripe for developing into the myth-laden king of later accounts.","362"
"#459","The basis of the Aztecs' success in certaing a great state and ultimately an empire was their remarkable system of agriculture, which featured intensive cultivation of all available land, as well as elaborate systems of irrigation and reclamation of swampland. The high productivity gained by these methods made for a rich and populous state.","342"
"#245","When you are typing on a typewriter, your input appears directly on paper.  When you are typing on a computer, your input appears on a screen and is transferred to paper after the proper command has been given.","210"
"#322","We all know people who are very bright but who do not always shine when it comes to being logical. They have the ability to think logically but that ability does not habitually manifest itself.","193"
"#77","Now did you answer cause you thought that's what I wanted to hear, or did you think about what I said and answer cause you truly believe that to be right?","154"
"#635","While it may hold true that the final few seconds of a bike race are fastest and apparently chaotic, at 70 kph and 200 heartbeats per minute, there's simply no time for anxiety. Adrenaline, yes, Instinct, sure. But fear, no.","224"
"#208","When I really worry about something, I don't just fool around. I even have to go to the bathroom when I worry about something. Only I don't go. I'm too worried to go. I'm too worried to interrupt my worrying to go.","214"
"#397","To some, the rules of etiquette may seem outdated, stuffy and unnecessary, but the fact remains that they serve as a sort of social weed-whacker eliminating unsavory growths from popping up in the world's finer gardens.","219"
"#413","The odds are that you will generally meet the worst of them. The reason is that men who have something going for them in their lives, men who passionately live life with a purpose, are usually too busy living their dreams to hang out ""trolling for chicks.""","256"
"#403","When we conceive of the sweetest being ever, we are conceiving of the being that exists both in the mind and in reality. Since the ninja is that being than which nothing sweeter can be conceived and that being exists in the mind and in reality, the ninja exists in reality.","273"
"#614","It was an effect of light: quick sunlight dappling, yellow leaves falling, a shower of gold, spangled, very fast, a falling of the bright.","138"
"#8","The streets were cleared by a Critical Mass bike ride and were flooded by activists dressed in second-hand suits with slogans painted on their backs. They danced in the doorsteps of office towers, formed a human chain around the Treasury and held peaceful sit-ins at several banks.","281"
"#244","Whether you use a PC, laptop, or typewriter -  typing is an invaluable skill. It's a skill that can open doors and enhance your career opportunities.","149"
"#214","We've known each other for many years but this is the first time you've ever come to me for counsel or for help. I can't remember the last time you invited me to your house for a cup of coffee, even though my wife is Godmother to your only child.","246"
"#13","It is a period of civil war. Rebel spaceships, striking from a hidden base, have won their first victory against the evil Galactic Empire. During the battle, Rebel spies managed to steal secret plans to the Empire's ultimate weapon, the Death Star, an armored space station with enough power to destroy an entire planet.","320"
"#367","Whether they use the title or not, many lyrics have evocative first lines that grab the listener's attention. Often thinking of a good first line can make the rest of the lyric flow.","182"
"#610","In the capital of the Sunbelt South, the quiet revolution of immigration and food continues to upset and redefine the meanings of local, regional, and global identity.","167"
"#47","But suddenly, I viddied that thinking was for the gloopy ones, and that the oomny ones use like, inspiration and what Bog sends. Now it was lovely music that came into my aid. There was a window open with the stereo on, and I viddied right at once what to do.","259"
"#58","My darling, you have to be standing up in order to be able to fall. I mean, if you keep sitting on your ass, nothing's gonna happen. ""Only brave warriors fall off their horses in battle. How can kneeling cowards know what a fall is?""","233"
"#691","Right now there are three people in chat, but there's no way of knowing exactly who until you are in there, and the chat room she finds not so comforting.","154"
"#487","There are men who possess a peculiarly strong visual memory, sharpness and accuracy of eye, presence of mind, dexterity of hand, and above all a subtle sense of touch, who are as it were born into God's world for the sole and special purpose of becoming distinguished card-sharpers.","282"
"#220","Caravans were being raided in a forest north of Rangoon by a bandit. So we went looking for the stones, but in six months, we never found anyone who traded with him. Then, one day I saw a child playing with a ruby the size of a tangerine. The bandit had been throwing them away.","278"
"#563","There's a piece of Maria in every song that I sing. And the price of a memory is the memory of the sorrow it brings. And there is always one last light to turn out and one last bell to ring. And the last one out of the circus has to lock up everything.","252"
"#605","Glancing through the 1977 Atlanta Yellow Pages reveals a city that had yet to be transformed by the proliferation of ethnic food: only ninety-two out of approximately fifteen hundred restaurants could be classified as non-American.","231"
"#158","The brain can be a tool. It can recall phone numbers, solve math puzzles, or create poetry. In this way, it works for the rest of the body, like a tractor. But when you can't stop thinking of that math problem or phone number, or when troubling thoughts and memories arise without your intent, it's not your brain working, but your mind wandering. Then the mind controls you; then the tractor has run wild.","406"
"#171","If we all go for the blonde and block each other, not a single one of us is going to get her. So then we go for her friends, but they will all give us the cold shoulder because no one likes to be second choice. But what if none of us goes for the blonde? We won't get in each other's way and we won't insult the other girls. It's the only way to win.","350"
"#703","Samatha is a state in which the mind is brought to rest, focused only on one item and not allowed to wander. When this is done, a deep calm pervades body and mind, a state of tranquility which must be experienced to be understood.","230"
"#160","If you don't get what you want, you suffer; if you get what you don't want, you suffer; even when you get exactly what you want, you still suffer because you can't hold on to it forever. Your mind is your predicament. It wants to be free of change, free of pain, free of the obligations of life and death. But change is a law, and no amount of pretending will alter that reality.","379"
"#353","Dean is the perfect guy for the road because he actually was born on the road, when his parents were passing through Salt Lake City.","132"
"#173","Yes, the newspapers were right: snow was general all over Ireland. It was falling on every part of the dark central plain, on the treeless hills, falling softly upon the Bog of Allen and, farther westward, softly falling into the dark mutinous Shannon waves.","258"
"#581","So it's all come back round to breaking apart again. Breaking apart like I'm made up of glass again.","100"
"#174","I drew the blankets over my head and tried to think of Christmas. But the grey face still followed me. It murmured, and I understood that it desired to confess something. I felt my soul receding into some pleasant and vicious region; and there again I found it waiting for me.","276"
"#617","When I was a kid, you never saw radicchio in the produce section, or a half dozen different kinds of mushrooms, or kiwis and passion fruit and durians and mangoes.","163"
"#2","But speculations on the structure of the universe also move in quite another direction. The development of non-Euclidean geometry led to the recognition of the fact, that we can cast doubt on the infiniteness of our space without coming into conflict with the laws of thought or with experience.","295"
"#333","Rebel spaceships, striking from a
hidden base, have won their first victory against the evil Galactic
Empire. During the battle, Rebel spies managed to steal secret plans
to the Empire's ultimate weapon.","203"
"#65","Overhead the albatross hangs motionless upon the air and deep beneath the rolling waves, in labyrinths of coral caves - the echo of a distant tide comes willowing across the sand, and everything is green and submarine.","218"
"#313","So what's in this for you? Should you rush out in search of a mission? Should you quit your job and find a goal? Probably not. But look around you. You may be on a mission, and not realize it yet. These are the good old days you'll look back on with pride. You might as well enjoy it now.","288"
"#532","The wine list looks so imposing that you finally give up laboring over it. You hand it back to the server and say, ""I'll just have a glass of white wine."" Smart move or big mistake? We'd say, ""Mistake.""","222"
"#619","The label doesn't mention that that rib-eye steak came from a steer born in South Dakota and fattened in a Kansas feedlot on grain grown in Iowa.","145"
"#521","And then he calls me a jerk and says the last guy who thought he was a jerk was dead now. So I don't say nothing and he says, ""What do ya think about that?"" So I says, ""Well, that don't sound like too good a deal for him then.""","247"
"#474","The invention of the wheel represented a major turning point in human civilization. Besides its use in transportation, the wheel went on to become the basic principle behind almost every mechanical device.","205"
"#230","Language is one of the keys to being human. It allows us to communicate with other human beings and to leave a legacy of our thoughts and actions for future generations.  The dominant temporal lobe helps to process sounds and written words into meaningful information.","268"
"#351","With the coming of Dean Moriarty
began the part of my life you could call my life on the road. Before
that I'd often dreamed of going West to see the country, always
vaguely planning and never taking off. Dean is the perfect guy for the
road because he actually was born on the road, when his parents were
passing through Salt Lake City.","337"
"#524","You could substitute raspberries or any other fruit, but 99.9 percent of all the wine in the world is made from grapes, because they make the best wines.","153"
"#78","Now I want you to think and stop being a smart aleck.  A man's attitude goes some ways - the way his life will be. Is that something you agree with? So since you agree, you must be someone who does not care about the good life.","227"
"#310","When we pulled out into the winter night and the real snow, our snow, began to stretch out beside us and twinkle against the windows, and the dim lights of small Wisconsin stations moved by, a sharp wild brace came suddenly into the air. We drew in deep breaths of it as we walked back from dinner through the cold vestibules, unutterably aware of our identity with this country for one strange hour, before we melted indistinguishably into it again.","450"
"#438","Every craft and every investigation, and likewise every action and decision, seems to aim at some good; hence the good has been well described as that at which everything aims.","176"
"#594","He rode past me and kept on goin'. Never said nothin' goin' by. He just rode on past and he had his blanket wrapped around him and his head down. And when he rode past I seen he was carryin' fire in a horn the way people used to do and I could see the horn from the light inside of it. About the color of the moon. And in the dream I knew that he was goin' on ahead and that he was fixin' to make a fire somewhere out there in all that dark and all that cold, and I knew that whenever I got there he would be there. Out there up ahead.","535"
"#637","Pulp: 1. A soft, moist, shapeless mass or matter. 2. A magazine or book containing lurid subject matter and being characteristically printed on rough, unfinished paper.","168"
"#247","Commas and periods always go inside quotation marks. Colons and semicolons always go outside quotation marks. Question marks and exclamation points go inside quotation marks when they apply to the quoted material only. They go outside when they apply to the entire sentence.","274"
"#612","It was an effect of light: quick sunlight dappling, yellow leaves falling (but from what? Were there even trees on West Fifty-seventh Street?), a shower of gold, spangled, very fast, a falling of the bright. Later I watched for this effect on similar bright days but never again experienced it.","294"
"#444","We speak of something carried and something carrying, of something led and something leading, of something seen and something seeing, and you understand that these things are all different from one another and how they differ? So there is also something loved and - a different thing - something loving.","303"
"#363","Every time I think of you I feel shot right through with a bolt of blue. It's no problem of mine but it's a problem I find, living a life that I can't leave behind.","164"
"#659","First of all, you must be comfortable, otherwise it will be overly tiring and very difficult to concentrate. Many races have been lost due to discomfort from a poorly fitted seat.","179"
"#31","I don't believe in painted roses or
bleeding hearts while bullets rape the night of the merciful. I'll see
you again when the stars fall from the sky and the moon has turned red
over One Tree Hill.","197"
"#119","The unknown future rolls toward us. I face it for the first time with a sense of hope, because if a machine, a Terminator, can learn the value of human life, maybe we can, too.","176"
"#227","Many years ago, a famous Arabian alchemist had visited Europe. It was said that he had discovered the Philosopher's Stone and the Elixir of Life.","146"
"#326","I have quit three jobs and been fired from all the rest. Getting fired, despite sometimes coming as a surprise and leaving you scrambling to recover, is often a godsend: someone else makes the decision for you, and it's impossible to sit in the wrong job for the rest of your life.","281"
"#704","When the mind is brought to rest and not allowed to wander, a deep calm pervades body and mind, a state of tranquility which must be experienced to be understood.","162"
"#153","Warmer water increases the moisture content of storms, and warmer air holds more moisture. When storm conditions trigger a downpour, more of it falls in the form of big, one-time rainfalls and snowfalls. Partly as a result, the number of large flood events has increased decade by decade, on every continent.","308"
